{
  "$schema": "https://json-schema.org/draft/2020-12/schema",
  "title": "IL descriptor (version 0)",
  "type": "object",
  "required": [
    "il",
    "id",
    "props"
  ],
  "properties": {
    "il": {
      "type": "integer",
      "minimum": 0,
      "description": "D: IL version, non-negative integer."
    },
    "id": {
      "type": "string",
      "minLength": 1,
      "description": "D-1: stable device id."
    },
    "source": {
      "type": "string"
    },
    "kind": {
      "type": "string"
    },
    "class": {
      "type": "string"
    },
    "label": {
      "type": "string"
    },
    "vendor": {
      "type": "string"
    },
    "model": {
      "type": "string"
    },
    "identifiers": {
      "type": "object",
      "additionalProperties": {
        "type": "string"
      },
      "description": "D-4: only what is needed to match the device elsewhere."
    },
    "props": {
      "type": "object",
      "propertyNames": {
        "pattern": "^[a-z0-9_]+$"
      },
      "additionalProperties": {
        "$ref": "#/$defs/property"
      }
    },
    "groups": {
      "type": "object",
      "additionalProperties": {
        "type": "object",
        "properties": {
          "kind": {
            "type": "string"
          },
          "class": {
            "type": "string"
          },
          "label": {
            "type": "string"
          }
        },
        "additionalProperties": true
      }
    },
    "x-mqtt": {
      "type": "object",
      "properties": {
        "state": {
          "type": "string"
        },
        "set": {
          "type": "string"
        },
        "reject": {
          "type": "string"
        }
      }
    }
  },
  "patternProperties": {
    "^x-": {}
  },
  "additionalProperties": true,
  "$defs": {
    "property": {
      "type": "object",
      "required": [
        "type"
      ],
      "properties": {
        "type": {
          "type": "string",
          "description": "One of binary, number, select, text, trigger, event; an unknown type is skipped by a consumer (X-2)."
        },
        "rw": {
          "type": "boolean"
        },
        "role": {
          "type": "string"
        },
        "group": {
          "type": "string"
        },
        "unit": {
          "type": "string"
        },
        "min": {
          "type": "number"
        },
        "max": {
          "type": "number"
        },
        "step": {
          "type": "number",
          "exclusiveMinimum": 0
        },
        "options": {
          "type": "array",
          "items": {
            "type": "string"
          },
          "minItems": 1,
          "uniqueItems": true
        },
        "label": {
          "type": "string"
        },
        "src": {},
        "requires": {
          "type": "string"
        },
        "class": {
          "type": "string"
        },
        "series": {
          "enum": [
            "gauge",
            "counter"
          ]
        },
        "category": {
          "enum": [
            "diagnostic",
            "config"
          ]
        },
        "x-mqtt": {
          "type": "object",
          "properties": {
            "state": {
              "type": "string"
            },
            "set": {
              "type": "string"
            }
          }
        }
      },
      "additionalProperties": true,
      "allOf": [
        {
          "if": {
            "properties": {
              "type": {
                "enum": [
                  "select",
                  "event"
                ]
              }
            },
            "required": [
              "type"
            ]
          },
          "then": {
            "required": [
              "options"
            ]
          }
        },
        {
          "if": {
            "properties": {
              "type": {
                "enum": [
                  "binary",
                  "text",
                  "trigger",
                  "event"
                ]
              }
            },
            "required": [
              "type"
            ]
          },
          "then": {
            "not": {
              "anyOf": [
                {
                  "required": [
                    "min"
                  ]
                },
                {
                  "required": [
                    "max"
                  ]
                },
                {
                  "required": [
                    "step"
                  ]
                },
                {
                  "required": [
                    "unit"
                  ]
                },
                {
                  "required": [
                    "series"
                  ]
                }
              ]
            }
          }
        },
        {
          "if": {
            "properties": {
              "type": {
                "enum": [
                  "binary",
                  "number",
                  "text",
                  "trigger"
                ]
              }
            },
            "required": [
              "type"
            ]
          },
          "then": {
            "not": {
              "required": [
                "options"
              ]
            }
          }
        },
        {
          "if": {
            "properties": {
              "type": {
                "const": "trigger"
              }
            },
            "required": [
              "type"
            ]
          },
          "then": {
            "properties": {
              "rw": {
                "const": true
              }
            }
          }
        },
        {
          "if": {
            "properties": {
              "type": {
                "const": "event"
              }
            },
            "required": [
              "type"
            ]
          },
          "then": {
            "properties": {
              "rw": {
                "const": false
              }
            }
          }
        },
        {
          "if": {
            "properties": {
              "role": {
                "const": "available"
              }
            },
            "required": [
              "role"
            ]
          },
          "then": {
            "properties": {
              "type": {
                "const": "binary"
              },
              "rw": {
                "const": false
              }
            }
          }
        },
        {
          "if": {
            "properties": {
              "role": {
                "const": "on"
              }
            },
            "required": [
              "role"
            ]
          },
          "then": {
            "properties": {
              "type": {
                "const": "binary"
              }
            }
          }
        },
        {
          "if": {
            "properties": {
              "role": {
                "const": "mode"
              }
            },
            "required": [
              "role"
            ]
          },
          "then": {
            "properties": {
              "type": {
                "const": "select"
              }
            }
          }
        },
        {
          "if": {
            "properties": {
              "role": {
                "const": "fan_speed"
              }
            },
            "required": [
              "role"
            ]
          },
          "then": {
            "properties": {
              "type": {
                "const": "select"
              }
            }
          }
        },
        {
          "if": {
            "properties": {
              "role": {
                "const": "target_humidity"
              }
            },
            "required": [
              "role"
            ]
          },
          "then": {
            "properties": {
              "type": {
                "const": "number"
              }
            }
          }
        },
        {
          "if": {
            "properties": {
              "role": {
                "const": "current_humidity"
              }
            },
            "required": [
              "role"
            ]
          },
          "then": {
            "properties": {
              "type": {
                "const": "number"
              },
              "rw": {
                "const": false
              }
            }
          }
        },
        {
          "if": {
            "properties": {
              "role": {
                "const": "current_temperature"
              }
            },
            "required": [
              "role"
            ]
          },
          "then": {
            "properties": {
              "type": {
                "const": "number"
              },
              "rw": {
                "const": false
              }
            }
          }
        },
        {
          "if": {
            "properties": {
              "role": {
                "const": "target_temperature"
              }
            },
            "required": [
              "role"
            ]
          },
          "then": {
            "properties": {
              "type": {
                "const": "number"
              }
            }
          }
        },
        {
          "if": {
            "properties": {
              "role": {
                "const": "swing_vertical"
              }
            },
            "required": [
              "role"
            ]
          },
          "then": {
            "properties": {
              "type": {
                "const": "binary"
              }
            }
          }
        },
        {
          "if": {
            "properties": {
              "role": {
                "const": "swing_horizontal"
              }
            },
            "required": [
              "role"
            ]
          },
          "then": {
            "properties": {
              "type": {
                "const": "binary"
              }
            }
          }
        },
        {
          "if": {
            "properties": {
              "role": {
                "const": "action"
              }
            },
            "required": [
              "role"
            ]
          },
          "then": {
            "properties": {
              "type": {
                "const": "select"
              },
              "rw": {
                "const": false
              }
            }
          }
        },
        {
          "if": {
            "properties": {
              "role": {
                "const": "brightness"
              }
            },
            "required": [
              "role"
            ]
          },
          "then": {
            "properties": {
              "type": {
                "const": "number"
              }
            }
          }
        },
        {
          "if": {
            "properties": {
              "role": {
                "const": "color_temperature"
              }
            },
            "required": [
              "role"
            ]
          },
          "then": {
            "properties": {
              "type": {
                "const": "number"
              }
            }
          }
        },
        {
          "if": {
            "properties": {
              "role": {
                "const": "color"
              }
            },
            "required": [
              "role"
            ]
          },
          "then": {
            "properties": {
              "type": {
                "const": "text"
              }
            }
          }
        },
        {
          "if": {
            "properties": {
              "role": {
                "const": "color_mode"
              }
            },
            "required": [
              "role"
            ]
          },
          "then": {
            "properties": {
              "type": {
                "const": "select"
              },
              "rw": {
                "const": false
              }
            }
          }
        },
        {
          "if": {
            "properties": {
              "role": {
                "const": "position"
              }
            },
            "required": [
              "role"
            ]
          },
          "then": {
            "properties": {
              "type": {
                "const": "number"
              }
            }
          }
        },
        {
          "if": {
            "properties": {
              "role": {
                "const": "tilt"
              }
            },
            "required": [
              "role"
            ]
          },
          "then": {
            "properties": {
              "type": {
                "const": "number"
              }
            }
          }
        },
        {
          "if": {
            "properties": {
              "role": {
                "const": "motion"
              }
            },
            "required": [
              "role"
            ]
          },
          "then": {
            "properties": {
              "type": {
                "const": "select"
              },
              "rw": {
                "const": false
              }
            }
          }
        },
        {
          "if": {
            "properties": {
              "role": {
                "const": "open"
              }
            },
            "required": [
              "role"
            ]
          },
          "then": {
            "properties": {
              "type": {
                "const": "trigger"
              }
            }
          }
        },
        {
          "if": {
            "properties": {
              "role": {
                "const": "close"
              }
            },
            "required": [
              "role"
            ]
          },
          "then": {
            "properties": {
              "type": {
                "const": "trigger"
              }
            }
          }
        },
        {
          "if": {
            "properties": {
              "role": {
                "const": "stop"
              }
            },
            "required": [
              "role"
            ]
          },
          "then": {
            "properties": {
              "type": {
                "const": "trigger"
              }
            }
          }
        },
        {
          "if": {
            "properties": {
              "role": {
                "const": "locked"
              }
            },
            "required": [
              "role"
            ]
          },
          "then": {
            "properties": {
              "type": {
                "const": "binary"
              }
            }
          }
        },
        {
          "if": {
            "properties": {
              "role": {
                "const": "unlatch"
              }
            },
            "required": [
              "role"
            ]
          },
          "then": {
            "properties": {
              "type": {
                "const": "trigger"
              }
            }
          }
        },
        {
          "if": {
            "properties": {
              "role": {
                "const": "opened"
              }
            },
            "required": [
              "role"
            ]
          },
          "then": {
            "properties": {
              "type": {
                "const": "binary"
              }
            }
          }
        }
      ]
    }
  },
  "$id": "https://example.invalid/il/descriptor.schema.json",
  "description": "IL descriptor, version 0. Rule ids refer to il.md."
}
